{
  "$schema": "https://json-schema.org/draft/2020-12/schema",
  "$id": "https://contracts.datumm.com/desktop-bridge/v1/bridge-response.json",
  "title": "Datumm Bridge Response",
  "type": "object",
  "additionalProperties": false,
  "required": [
    "protocolVersion",
    "type",
    "commandId",
    "jobId",
    "connectionId",
    "revitInstanceId",
    "routeGeneration",
    "leaseEpoch",
    "documentFingerprint",
    "outcome"
  ],
  "properties": {
    "protocolVersion": { "const": 1 },
    "type": { "const": "response" },
    "commandId": { "type": "string", "minLength": 16, "maxLength": 128 },
    "jobId": { "type": "string", "minLength": 1, "maxLength": 128 },
    "connectionId": { "type": "string", "minLength": 1, "maxLength": 128 },
    "revitInstanceId": { "type": "string", "minLength": 16, "maxLength": 128 },
    "routeGeneration": { "type": "integer", "minimum": 1 },
    "leaseEpoch": { "type": "integer", "minimum": 1 },
    "documentFingerprint": { "type": "string", "minLength": 16, "maxLength": 256 },
    "outcome": {
      "enum": [
        "NOT_DISPATCHED",
        "DISPATCHED",
        "COMPLETED",
        "FAILED_DEFINITIVE",
        "OUTCOME_UNKNOWN",
        "CANCELLED_BEFORE_DISPATCH",
        "RECOVERY_REQUIRED"
      ]
    },
    "success": { "type": "boolean" },
    "result": {},
    "createdElementIds": {
      "type": "array",
      "items": { "type": "string", "minLength": 1 },
      "uniqueItems": true
    },
    "error": {
      "type": "object",
      "additionalProperties": false,
      "required": ["code", "message"],
      "properties": {
        "code": { "type": "string", "minLength": 1, "maxLength": 128 },
        "message": { "type": "string", "minLength": 1, "maxLength": 2000 },
        "retryable": { "type": "boolean" }
      }
    },
    "durationMs": { "type": "integer", "minimum": 0 }
  }
}
